{
  "thresholds": {
    "min_sun_frac": 0.5,
    "min_earth_frac": 0.5,
    "ground_station_mask_deg": 10.0
  },
  "sun": {
    "uptime_fraction": 0.8427,
    "total_uptime_h": 284.0,
    "windows": [
      {
        "start_utc": "2026-11-01T00:00:00Z",
        "end_utc": "2026-11-12T04:00:00Z",
        "duration_h": 269.0
      },
      {
        "start_utc": "2026-11-14T10:00:00Z",
        "end_utc": "2026-11-15T00:00:00Z",
        "duration_h": 15.0
      }
    ],
    "longest_window_h": 269.0,
    "longest_outage_h": 53.0
  },
  "earth": {
    "uptime_fraction": 0.1573,
    "total_uptime_h": 53.0,
    "windows": [
      {
        "start_utc": "2026-11-01T00:00:00Z",
        "end_utc": "2026-11-03T04:00:00Z",
        "duration_h": 53.0
      }
    ],
    "longest_window_h": 53.0,
    "longest_outage_h": 284.0
  },
  "dte": {
    "uptime_fraction": 0.1573,
    "total_uptime_h": 53.0,
    "windows": [
      {
        "start_utc": "2026-11-01T00:00:00Z",
        "end_utc": "2026-11-03T04:00:00Z",
        "duration_h": 53.0
      }
    ],
    "longest_window_h": 53.0,
    "longest_outage_h": 284.0
  },
  "joint": {
    "uptime_fraction": 0.1573,
    "total_uptime_h": 53.0,
    "windows": [
      {
        "start_utc": "2026-11-01T00:00:00Z",
        "end_utc": "2026-11-03T04:00:00Z",
        "duration_h": 53.0
      }
    ],
    "longest_window_h": 53.0,
    "longest_outage_h": 284.0
  }
}